<?xml version="1.0" encoding="UTF-8"?>
<dataroot xmlns:od="urn:schemas-microsoft-com:officedata" xmlns:xsi="http://www.w3.org/2001/XMLSchema-instance"  xsi:noNamespaceSchemaLocation="Rbb.xsd" generated="2026-10-11T17:56:35">
<Rbb>
<ID>1</ID>
<N>Tab_CFG</N>
<V>1</V>
<E>1</E>
<T>1</T>
</Rbb>
<Rbb>
<ID>2</ID>
<N>Tab_Gest</N>
<V>1</V>
<E>1</E>
<T>1</T>
</Rbb>
<Rbb>
<ID>3</ID>
<N>Tab_OI</N>
<V>1</V>
<E>1</E>
<T>1</T>
</Rbb>
<Rbb>
<ID>4</ID>
<N>Tab_MF</N>
<V>0</V>
<E>0</E>
<T>1</T>
</Rbb>
<Rbb>
<ID>5</ID>
<N>Tab_rap</N>
<V>1</V>
<E>1</E>
<T>1</T>
</Rbb>
<Rbb>
<ID>6</ID>
<N>btnAddProd</N>
<V>1</V>
<E>1</E>
<T>0</T>
<C>gest_CPV</C>
</Rbb>
<Rbb>
<ID>7</ID>
<N>btnCategorii</N>
<V>1</V>
<E>1</E>
<T>0</T>
<C>Masini</C>
</Rbb>
<Rbb>
<ID>8</ID>
<N>btnUnitate</N>
<V>1</V>
<E>1</E>
<T>0</T>
<C>Config</C>
</Rbb>
<Rbb>
<ID>9</ID>
<N>btnCoduri</N>
<V>1</V>
<E>1</E>
<T>0</T>
</Rbb>
<Rbb>
<ID>10</ID>
<N>btnInchidere</N>
<V>1</V>
<E>1</E>
<T>0</T>
</Rbb>
<Rbb>
<ID>11</ID>
<N>btnAddNIR</N>
<V>1</V>
<E>1</E>
<T>0</T>
</Rbb>
<Rbb>
<ID>12</ID>
<N>btnDelNir</N>
<V>1</V>
<E>1</E>
<T>0</T>
</Rbb>
<Rbb>
<ID>13</ID>
<N>btnAddBC</N>
<V>1</V>
<E>1</E>
<T>0</T>
</Rbb>
<Rbb>
<ID>14</ID>
<N>btnDelBC</N>
<V>1</V>
<E>1</E>
<T>0</T>
</Rbb>
<Rbb>
<ID>15</ID>
<N>btnAddLA</N>
<V>1</V>
<E>1</E>
<T>0</T>
</Rbb>
<Rbb>
<ID>18</ID>
<N>btnLstSFP</N>
<V>1</V>
<E>1</E>
<T>0</T>
</Rbb>
<Rbb>
<ID>19</ID>
<N>btnFurnizori</N>
<V>1</V>
<E>1</E>
<T>0</T>
</Rbb>
<Rbb>
<ID>20</ID>
<N>btnClienti</N>
<V>1</V>
<E>1</E>
<T>0</T>
</Rbb>
<Rbb>
<ID>21</ID>
<N>btnAddStorno</N>
<V>1</V>
<E>1</E>
<T>0</T>
</Rbb>
<Rbb>
<ID>22</ID>
<N>btnAddBP</N>
<V>1</V>
<E>1</E>
<T>0</T>
</Rbb>
<Rbb>
<ID>23</ID>
<N>btnAddBT</N>
<V>1</V>
<E>1</E>
<T>0</T>
</Rbb>
<Rbb>
<ID>24</ID>
<N>btnAddBS</N>
<V>1</V>
<E>1</E>
<T>0</T>
</Rbb>
<Rbb>
<ID>25</ID>
<N>grp0</N>
<V>1</V>
<E>1</E>
<T>0</T>
</Rbb>
<Rbb>
<ID>26</ID>
<N>grp5</N>
<V>1</V>
<E>1</E>
<T>0</T>
</Rbb>
<Rbb>
<ID>27</ID>
<N>grp2</N>
<V>1</V>
<E>1</E>
<T>0</T>
</Rbb>
<Rbb>
<ID>28</ID>
<N>grp3</N>
<V>1</V>
<E>1</E>
<T>0</T>
</Rbb>
<Rbb>
<ID>29</ID>
<N>grp6</N>
<V>1</V>
<E>1</E>
<T>0</T>
</Rbb>
<Rbb>
<ID>30</ID>
<N>grp7</N>
<V>1</V>
<E>1</E>
<T>0</T>
</Rbb>
<Rbb>
<ID>31</ID>
<N>grp4</N>
<V>1</V>
<E>1</E>
<T>0</T>
</Rbb>
<Rbb>
<ID>32</ID>
<N>sep1</N>
<V>1</V>
<E>1</E>
<T>0</T>
</Rbb>
<Rbb>
<ID>33</ID>
<N>sep2</N>
<V>1</V>
<E>1</E>
<T>0</T>
</Rbb>
<Rbb>
<ID>34</ID>
<N>sep3</N>
<V>1</V>
<E>1</E>
<T>0</T>
</Rbb>
<Rbb>
<ID>35</ID>
<N>sep4</N>
<V>1</V>
<E>1</E>
<T>0</T>
</Rbb>
<Rbb>
<ID>36</ID>
<N>sep5</N>
<V>1</V>
<E>1</E>
<T>0</T>
</Rbb>
<Rbb>
<ID>49</ID>
<N>ExportExcel</N>
<V>1</V>
<E>1</E>
<T>0</T>
<M>PPVW</M>
</Rbb>
<Rbb>
<ID>50</ID>
<N>FilePrintQuick</N>
<V>1</V>
<E>1</E>
<T>0</T>
<M>PPVW</M>
</Rbb>
<Rbb>
<ID>51</ID>
<N>FileSaveAsPdfOrXps</N>
<V>1</V>
<E>1</E>
<T>0</T>
<M>PPVW</M>
</Rbb>
<Rbb>
<ID>52</ID>
<N>GroupZoom</N>
<V>1</V>
<E>1</E>
<T>0</T>
<M>PPVW</M>
</Rbb>
<Rbb>
<ID>53</ID>
<N>grp0</N>
<V>1</V>
<E>1</E>
<T>0</T>
<M>PPVW</M>
</Rbb>
<Rbb>
<ID>54</ID>
<N>PageSetupDialog</N>
<V>1</V>
<E>1</E>
<T>0</T>
<M>PPVW</M>
</Rbb>
<Rbb>
<ID>55</ID>
<N>PrintPreviewClose</N>
<V>1</V>
<E>1</E>
<T>0</T>
<M>PPVW</M>
</Rbb>
<Rbb>
<ID>56</ID>
<N>sep4</N>
<V>1</V>
<E>1</E>
<T>0</T>
<M>PPVW</M>
</Rbb>
<Rbb>
<ID>57</ID>
<N>sep5</N>
<V>1</V>
<E>1</E>
<T>0</T>
<M>PPVW</M>
</Rbb>
<Rbb>
<ID>58</ID>
<N>sep8</N>
<V>1</V>
<E>1</E>
<T>0</T>
<M>PPVW</M>
</Rbb>
<Rbb>
<ID>59</ID>
<N>tabPPVW</N>
<V>1</V>
<E>1</E>
<T>1</T>
<M>PPVW</M>
</Rbb>
<Rbb>
<ID>60</ID>
<N>btnAmmy</N>
<V>1</V>
<E>1</E>
<T>0</T>
</Rbb>
<Rbb>
<ID>61</ID>
<N>btnBCK</N>
<V>1</V>
<E>1</E>
<T>0</T>
</Rbb>
<Rbb>
<ID>63</ID>
<N>btnUPDN</N>
<V>1</V>
<E>1</E>
<T>0</T>
</Rbb>
<Rbb>
<ID>64</ID>
<N>btnAddRe</N>
<V>1</V>
<E>1</E>
<T>0</T>
</Rbb>
</dataroot>
